{
  "schema_version": "0.1",
  "protocol_registry_version": "0.1.0",
  "require_authenticated_membership_changes": true,
  "require_epoch_advance_on_membership_change": true,
  "require_removed_member_exclusion": true,
  "require_new_member_history_exclusion": true,
  "prohibit_server_membership_authorization": true,
  "require_device_revocation_rekey": true,
  "max_group_devices": 1000,
  "policy_id": "group-mls",
  "profile_ref": "group-mls-rfc9420@0.1.0",
  "protocol_id": "GROUP-MLS-1-RFC9420",
  "mls_cipher_suite_id": "0x0001",
  "pairwise_profile_ref": null,
  "sender_kdf_algorithm_id": null,
  "sender_aead_algorithm_id": null,
  "sender_signature_algorithm_id": null,
  "max_sender_skipped_message_keys": null
}
